reviewId,userName,userImage,content,score,thumbsUpCount,reviewCreatedVersion,at,replyContent,repliedAt,appVersion
d7be2438-4f11-40ed-b0cf-c2f9056bdd29,Surya,https://play-lh.googleusercontent.com/a-/ALV-UjU3X8WfkgNlH8Ew8XXhhn6IxVePC8iQn5HfrJSgBrxkucVMCXTP,God no. This is the worst app. No proper map routes. No customer support. To much prices for small distances. During nights don't even ask. Share rides are the worst. Co riders who join after you gets to be dropped first. You will sit for hhr to hr for a 10 to 15 mins journey. I really hope there will be another company who will start a similar competitive company. (BTW I have used Uber for almost 5 years) I would really ignore it if there was another mode of transport to my destination.,1,1,4.555.10003,2024-12-08 18:21:47,,,4.555.10003
619f6b26-3cd2-457d-b6ec-52b5a6ee7530,Siya Agrawal,https://play-lh.googleusercontent.com/a/ACg8ocJ9kg2G_Pzsen3u-BZEQ1MLLlgIskk1YGky4p4EeB37ZK1FQw=mo,"I haven't seen an app worst than this. Drivers are rude, they constantly cancel rides, they talk rude and often company does absolutely nothing about this. Please prefer Rapido or Ola over this app, you'll thank me. DO NOT USE THIS PLATFORM. I would've given it a minus review if that was possible.",1,1,4.555.10003,2024-12-13 13:58:40,,,4.555.10003
8749b045-3d8d-4663-a2cf-73c16e494007,Abhijeet Chowdhury,https://play-lh.googleusercontent.com/a/ACg8ocKxRa0BIiyfVgeRNAPIfYR_HkUZXSyZt5c67pr3A-H0hdwBvg=mo,"Uber follows unethical business practices to fleece customers! Very often theres a gap b/w quoted trip cost & actual fare charged, in spite of no changes to app defined route. When issue is raised, fare difference is refunded, but not always, as ""user profile had raised this issue earlier too"". Is it an users problem that you overcharge repeatedly? A bot that cant even read screenshots is the one to respond. Same reply everytime. Not even a customer response number. How very pathetic!!",2,3,4.548.10001,2024-10-22 22:07:22,"Hi, we want to take a closer look into this for you. Please send a quick note to t.uber.com/contact so we can connect.",2018-10-23 13:09:13,4.548.10001
032dca2c-7d01-497a-b716-bd228e70a25a,Chris Smith,https://play-lh.googleusercontent.com/a/ACg8ocKOHBLSOneSyMOuYB3pSMXsq7EuOpd_Oppbltkpn8NenecD9Q=mo,"The ride share isn't bad, the restaurant ordering isn't bad either. The uber one kinda is worth it if you order uber eats a lot otherwise it doesn't do much. DO NOT order groceries with it. I had a 45% off deal sonI tried it. Was over charged for the items and received the wrong items. Usually Uber is very good with fixing wrong orders or items but for this order they closed my complaint twice without any feed back as to what happened or what was wrong.",3,1,4.551.10000,2024-11-13 23:07:58,,,4.551.10000
ef0d5490-2a46-4d38-83f7-55a8480acce0,faith muli,https://play-lh.googleusercontent.com/a-/ALV-UjWxPixUX1VZL9onY9-qIVXSifxSqgO4M4Ha4IITgXxRK1HxmZmnwg,"I had no problem with this app until one of their drivers failed to complete payment. Even after payment of the said debt, the next driver did not complete payment, meaning I'd have to pay the same debt a third time to continue using their services. Reaching out to their customer service ,with evidence,has been of no help so far. Very disappointed.",1,7,4.553.10000,2024-11-28 08:17:36,,,4.553.10000
b7012732-a901-45c2-9379-0a1d3c798506,Anushka Mondal,https://play-lh.googleusercontent.com/a-/ALV-UjUcAJzukK_W3akBZv8B_N5s9bE3MJOoGammXZXfF4y8evNv0hf9,"I'll give it a 3 rating because sometimes resolving issues take a lot of time. And also, I think there should be an option to delete certain trip histories. Not all, but some. Like right now, we either have to delete the whole trip history, or let it be. But we should be able to delete some seleted trips. It would be helpful. I hope this change comes soon. Other than that, its overall, a good app. Convenient and easy to handle.",3,32,4.548.10001,2024-10-23 18:10:11,,,4.548.10001
96775cdc-2610-4a08-a8c8-b2186645c4a8,abhishek kumar,https://play-lh.googleusercontent.com/a-/ALV-UjVn76JFPgZGzABtP9h-fhZKmjBfsYfmUOWsWW8irmhG-Z1py4T7,"Worst experience with Rental and uber chat support today, travelled 38 km but app charged for 53 km. Support service not ready to understand this. If your map is not working, its your concern, it should not pay by customer, no where mentioned additional convenience fee. Uber user ,be aware when booking rental with uber.",1,2,4.555.10003,2024-12-09 06:10:38,,,4.555.10003
f44ce8c9-d941-4283-9783-d16156b022df,Varun J,https://play-lh.googleusercontent.com/a/ACg8ocJB33eFamx7ttQz7DPaIPRiUb7Yb-o5Y30VzINJE0aT2Z6mLQ=mo,"Sometimes bogus auto drivers. They cancel ride after reaching pickup location and just for the reason that they get more fare on another app. If you don't want to pick up when other app is giving you more fare, then don't pickup ride in first place and make customers frustrated.",1,4,4.547.10001,2024-10-14 07:49:01,,,4.547.10001
ec06c03a-8951-4961-b750-35ba89e76590,Ahmed Khan,https://play-lh.googleusercontent.com/a/ACg8ocKrE8AygicguZmYdkZquEQpBC7gxzDcNNbAvxrEPMzFbNIzhw=mo,"So many problems now (used to be good). Can't update phone number. Driver demands toll on top of estimated fare. No customer care number included in app. Customer care number listed on Google doesn't work. Safety number (from blue shield icon) doesn't work. Fare increases automatically by the end of trip, despite not having any traffic on the road.",1,8,4.554.10001,2024-12-01 14:04:52,,,4.554.10001
fc19567a-f344-4ccc-9f61-71c7dfc9ebd5,SamIAm,https://play-lh.googleusercontent.com/a-/ALV-UjWvk0d4wygg8-xJzXtUgzVGLbY713Xy1IKvXnG_MLTtnHJoaSjR,"Have no problems with all of my rides, drivers are great. I have a big problem with uber canceling a pre scheduled ride on short notice claiming they can't verify payment, even though they have already blocked out ride amounts from my debit card, and allowing me to schedule a ride. If you don't have a card on file the application won't let you schedule a future ride. This is beyond stupid and it's gotta stop.",3,0,4.553.10000,2024-11-27 20:39:01,,,4.553.10000
90cb9053-a679-4041-825b-43761ea69450,KRISHNA VIJAY,https://play-lh.googleusercontent.com/a-/ALV-UjVIcoC_3mCR6rVN7TxDMoz41S5hme7Q9fK6u3OrnD4y_JFZBjRT,Mostly experience is very good but one thing that 1) driver not come form time. 2) helmet issue.. Not in good condition 3) driver said that cancel ride for your side after cancle customer paid extra cancellation charegs. 4) wait time show 2 minutes but driver come 10 minutes why if emergency than? Improve some points for best service,4,0,4.555.10003,2024-12-06 20:11:22,,,4.555.10003
00eac754-053e-463f-a630-9ddf5f2939df,Aman Ullah,https://play-lh.googleusercontent.com/a/ACg8ocJSceAzrTNKe9x7qU7g7rAP_UlPP_zbJShbiwuR5POO_xTXww=mo,"Remove cancel ride option from Drivers App or charge heavy penalty because they morons cancel rides when someone in medical emergency or any critical situations, If you did not remove cancel option from Drivers app, I swear I will convince and delete your App from my all family friends relatives and colleagues and will everything until you remove that option. Start now.",1,1,4.555.10003,2024-12-10 17:37:40,,,4.555.10003
5b63e379-a89d-4b65-8546-b5d609f28d12,fanny francisca,https://play-lh.googleusercontent.com/a/ACg8ocIQlHm-o9hG3MR2QYeMXr0ybc55yWef9FPmSoaLJlTu3Es67g=mo,"Great with the teen account, except as a parent, I have no access to previous trips from my app except the individual receipt notifications sent to my email. I cannot look back on the spending history from my teens account except I check my emails. I would love there to be a way to access past trips the whole family from the app, without having to ask my teenager for their phone or going to check my emails.",4,1,4.551.10000,2024-11-11 15:40:50,,,4.551.10000
e047287b-8b22-442b-8032-35969db05cac,v.vignesh kumar,https://play-lh.googleusercontent.com/a-/ALV-UjVJR5jeYVIgF-ft_Q-M09wSQ9fqSbBYOn0mYTUWfZNTlif_nZk,I am totally exhasuted today...previous some bookings drivers not available but today i am in urgency i booked the moto 1st one attend and cancel immediately 2nd one accept and on the way after waiting for 5 mins he also cancel the ride without any information 3rd one also attend and cancel immediately...i can't expect this...i waiting the location for past half an hour to book a moto...you guys thinking your price will get more customers. It not it only depend on how you give the service.,1,1,4.556.10005,2024-12-14 07:46:03,,,4.556.10005
583d98e6-29f1-4ef1-b205-a7a0d528326f,Hasnain,https://play-lh.googleusercontent.com/a-/ALV-UjV4tQt7wq00IqDYwK7k6yrF_sMkHi_LDCutweNXC9G7QO1O8jKbDQ,"App constantly shows ""no internet connection"" even when I'm connected to mobile data and Wi-Fi. The app takes forever to open, with long loading times. When I finally search for a ride, it takes much longer than it should to book. Overall, the performance is disappointing and needs serious improvement.",1,127,4.549.10000,2024-10-25 16:33:06,,,4.549.10000
0b900e79-7df6-4391-9fdc-3e98cac254aa,Brett Alexander,https://play-lh.googleusercontent.com/a/ACg8ocKtPqs7joZD1VOcVlUisIRU1UsqBkDmkk3-Ip02yvHoNIR3lw=mo,The two factor authentication takes two devices. The app crashes if you leave the screen to read the temporary pin and you start all over again in an endless loop,1,1,4.555.10003,2024-12-06 07:33:52,,,4.555.10003
00f4f2cd-6cae-490d-b09b-524fecf942d4,José Pedro Santos,https://play-lh.googleusercontent.com/a-/ALV-UjXMaFmNfEtOWs4EbCHsLQ2Zyc8ZGhpggfMY3EEf2hDttx-msTGU,"Good luck figuring out how to contact support. It's impossible. You only get automatic replies from their help articles. My driver took a wrong route and ended up going through some very unnecessary tolls which were then charged to me. I requested a review of the payment and because it's all automated, the app decided the value was correct. There is no way to talk with the support and explain the situation, not on the app, not on the website, not anywhere. Worst costumer service I've ever seen.",1,44,4.545.10000,2024-10-18 13:37:24,,,4.545.10000
30ca3de9-6ced-4068-8315-74cfefb4e80a,Charles Weis,https://play-lh.googleusercontent.com/a/ACg8ocKiXxgmYuMBftWAYMLDZdj0ROn8twPfwBBbclEdajbeSJqnig=mo,"App is fine... Functional, reliable service (app doesn't crash often), and Uber eats is pretty good. My concerns are that ride time estimates are not accurate or up to date for my area (a lot of population influx since COVID) and the app is really clever at not allowing you to identify a problem without blaming the driver. Uber wants you to critique the drivers not the company, but sometimes the shoe fits.... There is not a great system to dispute ride ratings either.",3,4,4.549.10000,2024-11-01 16:46:15,,,4.549.10000
00dfd5e0-1503-4b1f-b378-ef555c4fad19,Rebecca Deborah Naude,https://play-lh.googleusercontent.com/a/ACg8ocJUnrSkieLQyH-vPpMzwLLHXTcIYf6naCE3mgNFsRZ0jWLbBA=mo,"My experience while using this app has been awful these last few months - I can't change my display to 'dark' mode anymore, and I keep on having to use a 4 digit code that is sent to me via SMS to be able to log in (I can't stay logged in either), and after I complete this process I receive an email informing me about a 'new device log in' like the app doesn't recognise my phone anymore even though I have had the same phone for the last four years (my number hasn't changed either).",1,16,4.554.10001,2024-12-02 17:18:12,,,4.554.10001
c9d658b0-3003-4ef0-a5ef-f7b00b139b2f,Dellerra Parrington,https://play-lh.googleusercontent.com/a/ACg8ocIdnuDOV0oEVWWkthg-PJSs7oZ52QPd_HqdcFDIRNIwQoREUQ=mo,So I'm giving it a three I originally had at five star but as of late I've noticed that there's been more and more issues not only with the app but also people accepting rides and then canceling them suddenly especially when they like 5 minutes away and then I get back in the queue looking for another one it's very inconvenient when you're need to be to work. I feel it should have another option that only pulls the closest drivers available Once they accept ride they shouldn't be able 2 cancel,3,5,4.553.10000,2024-11-24 08:59:28,,,4.553.10000
dcdf5515-6637-4085-9e7c-9d87de506d54,Mary Ader,https://play-lh.googleusercontent.com/a/ACg8ocKoF9G-P6RbQ3uX5Ihg-EDR24h7IBxI5ZWXh74Iw7BZplB2cBQ=mo,"I hope you make arrangements for a different ride when they're busy or the weather's bad because if you don't you'll be paying out the *ss...anytime they get busy they jack the price up, what usually costs me $9 will cost me $40...they just do this to take advantage of people...I would've given no stars if I could because this happens to me almost everyday",1,1,4.555.10003,2024-12-10 17:22:14,,,4.555.10003
908261c4-d014-44f9-a688-51c76227f7a9,Anthony Maddaluno,https://play-lh.googleusercontent.com/a-/ALV-UjVAccrOEPXTXBoFr38yn_4ge2KIFl1dNjhQ5HMvSPnbLqIXdCU,"An app where the store can completely mess up and have items compleatly missing from your order, and offer nothing to fix or compensate for it. You pay for the order, delivery charge then get hit with nonsensical service charges that double the price. Only did one order, never again. Absolute trash of a business.",1,10,4.549.10000,2024-11-12 14:56:37,,,4.549.10000
58230ba8-ae9c-48b8-9d94-7fcef50d12a2,Sandy Bellows,https://play-lh.googleusercontent.com/a/ACg8ocJFGDoGdf7H1yGhlmAxKu9hFBG1-CMpgYKHSIgF33DDxcZ1=mo,"The app and service are generally fine but I'm reporting that the app now appears to be automatically tipping without my authorisation. I generally tip, but I don't want it to be automated. Nothing in my settings suggest I have control over this, and it appears to have happened before I did so myself, so please could you investigate the app and how it links with PayPal. Thank you.",3,7,4.546.10002,2024-10-11 10:10:44,,,4.546.10002
8e2bb05c-7d72-4971-a3ec-eede9e37d278,Darrol wanza,https://play-lh.googleusercontent.com/a/ACg8ocKcuEfoxL-4rEDaEs5lRNFJqESMxhGvbf9KJRFtdU03d5dBYg=mo,"Very difficult to sort out payment issues using this app. It's as if Uber doesn't want one to reach them by offering unrelated option on the app, rather than the one that needs being addressed Often a fee is charged and a huge increase is added even though the trip was quick and uneventful.",1,5,4.551.10000,2024-11-07 13:03:47,,,4.551.10000
1f5785ad-37bb-4bc2-aecf-16063c6a5a05,Ravi Gupta,https://play-lh.googleusercontent.com/a-/ALV-UjUCC4EL1J5Y_Yt8Fdgzmtzo3foCWaxotrL0IbUhqIcufddskwWo,"First of all the driver cancelled the ride and waiting period for another to accept. And before booking the ride the price is low but after reaching the destination the final amount is too high without any long traffic or changing the route.Uber has became useless to use, deleting the app and another new users don't use this app. Uber rides are scam",1,3,4.554.10001,2024-12-04 22:08:58,,,4.554.10001
f271bc9c-4970-4c69-a2db-5184a82b3c3b,Joseph Zielinski,https://play-lh.googleusercontent.com/a-/ALV-UjU1G2tVY099E8nmIF7Xz6kdH7QL3PNY8I1LDy-kED3DFSazSPFu,Reserved a ride. Was suppose to be $85. After the ride suddenly I got charged over 100. Tried to get support and I just keep getting messages asking for screenshot. I send those then get asked for screenshots again. There's not even a live person to talk to. Of course after all that now I can't even use the app for food or rides. Keeps saying error every time I try and same thing. No support help AT ALL. This app is even worse then Lyft now.,1,2,4.548.10001,2024-10-18 08:10:44,,,4.548.10001
a0369cd6-3507-4e80-8067-ecdfab07e79e,S Venkat,https://play-lh.googleusercontent.com/a-/ALV-UjXBcdbuffLhEWKMTASlbcuX6Dqg9oBVKoeAQEcAcywUyhZul0kU,"Left at the mercy of drivers. Pathetic! Had to go to the hospital. After confirmed trip, with a pickup on the way which was already added in the app, just before pickup drivers are cancelling after asking for the drop off location, & it's again redirecting me to other drivers. Happened twice, waiting for almost an hour now. HORRIBLE! If the drivers are notified initially itself about the trip added, they can confirm, thus not wasting our time! Not dependable in case of emergency.",3,16,4.539.10000,2024-11-24 11:31:49,,,4.539.10000
578559d2-7c14-4bd3-83a6-dadd9159f7c5,shamiso chimbudzi,https://play-lh.googleusercontent.com/a-/ALV-UjVYiXg0typVoCU6gKWz61pbCzBTkm4KclsNo6HLmsrgkU3o8-lmWg,I have a problem with uber card payment. This is happening for the second time..they don't refund the money upon trip cancellation. They call it authorisation hold. It is frustrating that there is nothing you can do about. From 28 September up to 13 October I'm still waiting for the money to be refunded.. And last time I spoke to one of their agent the person was very rude. I'm disappointed about their inconsistency regarding this issue.,1,4,4.547.10001,2024-10-13 08:46:29,,,4.547.10001
65152923-57bd-4d9b-b931-94a8544a8ae9,Parth Malhotra,https://play-lh.googleusercontent.com/a-/ALV-UjW-FKcUIgwh0hSEVBYyoHP5df7mDhAcHjFTs_eef41VYuOvrrA,"Very unprofessional approach from driver side. I prebooked uber the previous day for railway station. Driver, on the day of travel, was late by 15 min and was not receiving my calls. Also when he reached the pickup point, he cancelled my ride and picked up someone else. I almost missed my train. I have complaint to uber but received no response. This happened earlier also when driver cancels ride on last moment.",1,1,4.549.10000,2024-11-04 03:51:58,,,4.549.10000
af403a98-54f7-40a2-a235-9a333193cdac,Rakesh Kumar,https://play-lh.googleusercontent.com/a/ACg8ocJfkSWyX0EN0KgC6J5_NjD_i0AI_qJXBqwCuZfPIL3pPEdPeCM=mo,"Service is not good as it's was at his initial time, drivers are very bad especially in Delhi, always I was payed more than the actual amount of the fare, drivers ask us to cancel the the ride and if we cancel it app charge us cancellation fees and if weren't drivers ask for extra money for the same journey... It was very embarrassing to facing such kind of problem with the reputative app like Uber..",1,4,4.553.10000,2024-11-27 08:06:23,,,4.553.10000
c3bf6a42-8468-46a3-b33c-813dd7f19ad8,Seema Hatiskar,https://play-lh.googleusercontent.com/a-/ALV-UjV9Sygc1JqA-KWmUqa3DsDdf9y3uXek09ggBXF_pElQNKH2KrYX,It's good .. But please update it with feature of selection of route since many times due to route changes by driver with their own choice or by customer with their own choice arises crises,3,0,4.556.10005,2024-12-20 18:56:06,,,4.556.10005
3710d2c0-adae-412b-845c-1b1e6b8c79c4,Connor Dries,https://play-lh.googleusercontent.com/a-/ALV-UjUN93eUC13zAh-7Ew38jhRFiQ7K6_xDijQuxUoDs35Wos_M6rA,"Prices go from being unreasonably low, to ridiculously high. My home to my town costs between £10 and £30 depending on surges. When I'd be happy to pay £15 to £25 depending on the surge. The extremes are just to great and it seems that the drivers suffer and many people who only go out at peak times will only ever experience high prices.",1,3,4.552.10000,2024-11-16 23:54:48,,,4.552.10000
bb231df6-afc9-480f-80ec-9bd110cc9480,Mahtia Hossain,https://play-lh.googleusercontent.com/a-/ALV-UjXge4CQ81IN6Ief5fIFtwQWwzgdaL0HspAlyT35vb7DROkoFXfjGA,"Awful riding app. No consideration for rider's time. Would give me the same driver repeatedly whom I said I didn’t want. Doesn't even have a proper custoner service for passengers. Another day, another issue. Kept showing that I was picked up and was headed towards my destination, when the driver was no where near me. Then they cost me the full fare when I cancelled.",1,3,4.546.10002,2024-10-11 01:44:38,,,4.546.10002
e99a1c15-96d8-4d96-bc60-9f39173b0ad6,RN Diva,https://play-lh.googleusercontent.com/a-/ALV-UjWBH33BQXQXTskFzC1xrbXfv-CB9aN_92IsfcsA41MByYNsG_QH,"I use Uber very frequently and have been for a few years without any notable issues or complaints. My pickups are quick and drivers are always very nice. Having this option, that is a lot cheaper than the local cab companies, is a much welcome and greatly appreciated convenience in my life! Update: Wrote this in 2022; it's now November of 2024 and I'm still loving Uber with no complaints! 💖",5,24,4.554.10001,2024-11-29 16:10:57,,,4.554.10001
2adb2cbd-ba09-4906-b558-577f8ed470df,Alison •,https://play-lh.googleusercontent.com/a/ACg8ocKPwD3XjbkJ2qvFYkbeNQclfLk0M2r8MK1n8_fWBbGX2UZV5g=mo,"Two weeks ago I encountered an issue with my uber credits, I reached support and it's like they don't read my messages. They tell me amounts that I am not saying myself, they respond to me as if they have fixed my issue when they don't even seem to have understood the problem. Several of them have a finished the conversation without actually giving me a solution. This app has the worst customer service agents in the entire planet. Extremely disappointed.",1,9,4.549.10000,2024-10-28 05:37:01,,,4.549.10000
c9abde07-5e28-429d-a2d0-b0432bf904d2,Alex M. Ramirez,https://play-lh.googleusercontent.com/a/ACg8ocJ05GGIlzfCMEwhRckxRbkl5rsoWk03m0ek_2XWEml4D5n2tw=mo,"Im pissed, a year, using Uber as only way of getting around Miami, im 5star member. On 12/5 W no money in the bank to call uber (first time) in need stranded & $2 cash. less than 4miles ride straight line. , i got to speak to an actuall human which is unheard of & explained my situation, i said to please take me home that I'll pay for ride my next ride. NOPE! Today i took uber, since UBER LEFT ME SHOWING NO LOYALTY, even tho in profile help menu there is an option membership & loyalty. F.U",1,1,4.555.10003,2024-12-11 12:24:34,,,4.555.10003
418fc65b-9890-44fe-806b-6538b4ce6235,Dave,https://play-lh.googleusercontent.com/a-/ALV-UjWNaM73MI6s44t3iPV7HpG3rrM6cVziTBTK3Kh6tE7HHCA0_Ln1,Been very happy with the bookings but the process can be a bit tricky to book in advance. This morning my only option is an XL when I know X should be available. Also it seems impossible to make a small edit in pick up point ie house number. So if my only option is XL then I may as well ask the hotel where I'm staying to book a regular taxi to airport.,2,8,4.547.10001,2024-10-20 12:42:18,,,4.547.10001
6e34478d-163b-4757-9a26-32650eee43f7,Lisa Parveen,https://play-lh.googleusercontent.com/a/ACg8ocKCCmOmLxDsnpcEZ760alc8lFsB-Z942dpD32KknBHQKJqBvA=mo,"I have booked an Uber Shuttle on 30.10.24 at 12.46 pm. But the driver canceled the trip at 1 pm, by that time no more shuttle was available for this route. I have an important meeting to attend from 2.30. I have lodged a complaint regarding the matter. As a competition, they provide me a free ride on uber Shuttle. However, I contacted them again just to let them know that no more shuttle is available for today on this route. But they didn't do anything about this. Such a disastrous experience!!!",1,5,4.549.10000,2024-10-30 12:15:49,,,4.549.10000
783096db-36fc-4d68-b102-41e8790677ed,Zachary Loftus-Smith,https://play-lh.googleusercontent.com/a/ACg8ocKlEDdGI02refa00atYCSOjH6jZ6RZsEKxp-YhJppfDO_SY7Y0=mo,"This app used to be the standard and I used it for years, but I don't know what happened lately. Several minutes just to find someone to accept a ride, 20 to 30 minute wait times for them to get their, and prices higher than they ever were before",2,1,4.555.10003,2024-12-11 16:40:01,,,4.555.10003
d35abd83-7b8a-4e49-9a32-1749e0c8136b,Yar Ilich,https://play-lh.googleusercontent.com/a/ACg8ocKmEnIKvLiXQQKL6OAQ_GYXmqTJ6CRNuBrxnJdthnVNHltMEw=mo,"Keeps frustrating. The rides in general take longer to get to me than Uklon. No way to increase the fare to attract drivers. A couple of times couldn't find a driver at all. You may get a surprise charge for riding through heavy traffic. Cancellation fees may make no sense. Address typing form is annoying. Uber doesn't want to hear from users: no human support, no contact for suggestions, which is off-putting and is my biggest gripe.",3,1,4.552.10000,2024-11-22 20:10:30,,,4.552.10000
6601457c-8748-4035-bd17-e98e6224744c,gameing friend's,https://play-lh.googleusercontent.com/a-/ALV-UjULeLfOmoqkIpdH7dWTwQDjI-aAZN7c6UcHGgWFbV-tsjZmL9dv,The worst app I have ever used ... Don't show where driver is even change the fare in fraction of second.. waiting time tooo long .... And when driver is to long and we have change our mode of transport then also we have to pay them The worst app,1,2,4.555.10003,2024-12-06 10:45:02,,,4.555.10003
9543bced-a9e1-429c-b45e-0f95e5a863a5,Hadiya Kn,https://play-lh.googleusercontent.com/a-/ALV-UjUHp6sDvyvN0jHPHx9r4a5ZZAKc5GGyY-1M57ID6gXMLfigpKU,"Even though Uber has helped me when I needed it to which I am not complaining about, the amount that was for the same ride at the same time to the same place is now not same anymore. When I first started using uber the amount shown was 80 and above. But now I am experiencing a different experience due to the raising in amount whenever they pleases at diffent time.This is the best I can give",1,4,4.552.10000,2024-11-19 13:43:51,,,4.552.10000
eccef5a5-d1d9-4d0e-adcf-080c558e23b0,D. Gould,https://play-lh.googleusercontent.com/a-/ALV-UjWFqovbo7NKJ8Up8QUTq2s9GN-i-I54y1QhmqPGR0DpkInN-Koy,"You can rate drivers, but never the wait time experience. It's common for a request to be bumped between 2-4 drivers and a wait time to go up from 5 minutes to 30 minutes in the process. It's not fair to ding the final driver for this and it gets lost. It often makes calling a driver just not worth it. However it's just not reliable to use when you actually need to get somewhere by a certain time.",3,9,4.548.10001,2024-10-24 21:52:17,,,4.548.10001
