reviewId,userName,userImage,content,score,thumbsUpCount,reviewCreatedVersion,at,replyContent,repliedAt,appVersion
b8948a16-f1ab-4a79-a689-56bdcc0fe60a,S Bros,https://play-lh.googleusercontent.com/a-/ALV-UjUVEv0SFPjZhTQzSBRiqr2fmSa-N-vLjXWQcPpJUI7QYl3VPmU-,"Uber was my favourite and have used it extensively for short and long distances but for the past some months it has become like one of the other apps in its category. The rates are on the higher side, the new promotional emails and notifications are fake, they don't actually provide discounts as claimed in this promos. The drivers are somewhat weird, one such driver stood at an incorrect location & waiting charges was billed.",3,56,4.556.10005,2024-12-14 13:43:56,,,4.556.10005
69c139df-90f3-4906-a005-68659e906989,Sridevi Thalanki,https://play-lh.googleusercontent.com/a/ACg8ocJjeCMK06xRNJNZGERwVQfAREZzDPNbEmeS5G1jodFA2kABqg=mo,"Worst experience ever I wouldn't recommend this app at all , I had a appointment for passport renewal at 2pm pm so I started booking from 12 00 literally they couldn't even fetch a vehicle for 12kms distance even tho it's booked the driver calls and cancels the ride . Not at all reliable",1,2,4.555.10003,2024-12-11 11:42:06,,,4.555.10003
308d7718-ddcd-4734-93f5-38dfce0b34cd,ANJALI REDDY,https://play-lh.googleusercontent.com/a-/ALV-UjX_8ws8uDIFY9Ob2UhL7sxqWSfCQlSGfbucM6-XtBhZNOnBTuMc,"I booked a ride with Uber and it showed 1 minute away. However it took 23 minutes for the driver to reach me. I made it to my train by the skin of my teeth. Uber does not even have a number where one can call and speak to an executive. Very unprofessional, unreliable and unpredictable service.",1,1,4.555.10003,2024-12-13 03:48:49,,,4.555.10003
fb23de7b-b1e6-4695-94bf-b30faceddc00,Peter Ho,https://play-lh.googleusercontent.com/a-/ALV-UjVszdr-YrdeenTaIrfRuu71x6yc7mG0FL8uZAg4XB_AG0p6dLrY,"It used to be great, but lately it takes very long time to get a driver than usual. Sometimes the driver cancel your booking, and it looks like they can pick customers whether they want to do it or not. And now it charges a lot more than other taxis. Will stop using Uber now and start using other taxis.",1,2,4.555.10003,2024-12-08 15:41:16,,,4.555.10003
cbfd5ffb-2459-4a5b-aa5b-cbd3ce5e9c10,Pedro,https://play-lh.googleusercontent.com/a/ACg8ocLNG6SD9JA3iEdC0LFg1GQMSUgdplgWMXyHw4s-208XqDb_QQ=mo,"Customer service is the worse... they just don't care at all about the wrong doing of the drivers. Plus it's more expensive than other apps. And at least in my area, drivers have so many wrong doings like driving away without you just to collect the cancelation fee since the app makes it so complicated to complain about the drivers that a lot of people just let it go. Many of them are maniacs on the road and they get offended if you ask them to drive safely or they straight up ignore you.",1,2,4.555.10003,2024-12-10 16:14:39,,,4.555.10003
0d13569c-9090-484f-8a0c-85634762de52,Swikriti Agarwal,https://play-lh.googleusercontent.com/a/ACg8ocJoTMWt-4ewgH_ZDtJn7gf-YZ1DR_VNokSP1_qMh2Ctu7nkAA=mo,"I booked a ride at ₹363. The driver took some different route than the one showing in the the app. When I reached my destination, the fare was ₹477. While we were unloading the luggage (which took 1 min), the fare raised to ₹482 and kept on increasing. Why are we getting charged when the driver took the wrong route or even when the cab was idle at the destination. The driver was also very rude. He was not accepting that he took the wrong route and was blaming us.",1,86,4.556.10005,2024-12-16 18:56:05,,,4.556.10005
35ba6ebb-b11c-474c-a802-8559ed7efcc6,Marissa Wong,https://play-lh.googleusercontent.com/a/ACg8ocJKcRf0avMfUosidEQYN6FgQVVpEpvXWlI-vBEmoVujQzEFhA=mo,"This app is a joke. It's charging me for past orders from over 6 months ago. When requested help in the help part, there is no answer for days. Gonna have to call my credit card and dispute the charges. Their help number doesn't even work anymore. They overcharge you on rides after giving you an agreed upon price and not by a couple of bucks but sometimes by 50-60 dollars. Feels more like a scam than anything now a days",1,2,4.555.10003,2024-12-11 04:14:16,,,4.555.10003
ce7e8867-6a5e-4cc5-b764-647093a1b4fe,Rashmi Roy,https://play-lh.googleusercontent.com/a-/ALV-UjW3oDVsCw8Won_L-_kcejEy1dQIIZhsO2bHkiKlb8vAa-nZLcLu,"Uber Moto drivers are really bad. Y'all should have better criteria for choosing Uber Moto drivers. They give absolutely no heed to safety ( one even almost toppled over the bike when I was behind when turning ) and traffic rules or the traffic police. Rapido is far better for bikes. But for cab it's fine, I guess. Tad pricier, but acceptable.",1,133,4.556.10005,2024-12-14 20:22:26,,,4.556.10005
f6227ca1-7595-4da0-9a52-bdc031e240f6,sunitha manish,https://play-lh.googleusercontent.com/a/ACg8ocIP54_qtODiPunrbRBMwIJI-RA73Zayk-fNNKZ07OD5qz5tmcE=mo,"Extremely dissatisfied with the app I book an auto, it shows a certian amount and then upon reaching the destination the value in the app increases This happens every second time i book an uber If not that the drivers demand extra money or claim to not have change Some even try to take the longer route",1,1,4.555.10003,2024-12-10 15:10:58,,,4.555.10003
5ebd2b99-8355-463d-9f9c-0db67c0af969,kgesi makhudu,https://play-lh.googleusercontent.com/a/ACg8ocKsR_kIgt9rnqSHhIPV-VZZi-p6JLiABjwVml90ng-p3WBJ6g=mo,4 days ago I requested a cash trip for my mom. The driver was given cash but I still had the amount owing on my account. This amount which was already paid affected my next trip which resulted in me having to settle it before I could request a trip. I paid for a single trip twice. After multiple escalations to Uber this issue remains unresolved with agents advising that it has been resolved. This is unacceptable as I have never had any driver steal my money🤬😡😤 I don't recommend Uber at all😡,1,1,4.555.10003,2024-12-10 08:35:39,,,4.555.10003
06c9d0b1-e6de-45b7-8580-e3752766d7f4,Mike Urbanski,https://play-lh.googleusercontent.com/a-/ALV-UjW2ZVJ5RkGxjBem0pXwoKcFeRx6SoMYxyK3yw4_Bpy2fP8FPuk,"It's a good service, but the billing is getting out of hand. The rate changes on almost every ride you take from what you choose for the car type. Traffic, weather and time shouldn't change the agreed on price.",4,2,4.555.10003,2024-12-08 07:49:51,,,4.555.10003
d52e99f3-e4f9-4562-8e4d-0651cebae793,Hannah Conn,https://play-lh.googleusercontent.com/a/ACg8ocLUDeuWvQjbcbUCPLrq3ZgzEbVOTK7aQOw0IR8zEOAKbQbGxg=mo,"I highly suggest not using Uber for grocery delivery. One delivery driver went full rouge and picked the most random items for replacement for items that ""couldn't be located."" Trying to bring this to the attention of Uber is futile as they just end the help conversation as resolved when Uber doesn't reply or Uber just doesn't answer.",1,1,4.555.10003,2024-12-11 22:57:29,,,4.555.10003
a032e109-6f2c-4e9d-b66c-69d9c0917164,Andrea Sabbato,https://play-lh.googleusercontent.com/a/ACg8ocI4ksEbqT_V4MiL0GKSGiyIpDez3fCLfczmKPF5PGKmHv8kgA=mo,"I reserved a ride to the airport 24h in advance for an early flight. The app didn't find any driver until 30 mins past the time my ride should have shown up. I just barely made it to the gate on time, running through the whole airport. I am not going to trust this service ever again.",1,0,4.556.10005,2024-12-19 16:48:28,,,4.556.10005
96ce5514-5e5d-4825-be5e-04d94fcb4903,Lelethu Mgquba,https://play-lh.googleusercontent.com/a/ACg8ocL5rLCKPCVne3GvCSLxlWa54Pjn-OHZEaZTh4cgBNSkk5qnMQ=mo,Customer service has been very disappointing lately. I reported a package driver and I saw on the app that the driver made a 30 minute stop elsewhere. I called the driver and he proceeds to lie and tell me he is stuck on the N2 traffick at 1pm!!! I reported this because the price went up almost double the amount and Uber never resolved that issue. I am so close to deleting my Uber account and never using it ever again.,2,1,4.556.10005,2024-12-13 10:53:37,,,4.556.10005
cdf94bdb-d36f-4a17-aa63-4155b6cec8a8,Sonam Khotwani Bharti,https://play-lh.googleusercontent.com/a/ACg8ocKJLwWZWLpqrPXbzBbwM11-oItKX5cvgmP_WSi9Kx271UXRrA=mo,"I lost my phone in cab after my trip & it was switched off. I kept complaining from other person's app using uber,sent mails to customer support,tried calling representative but no one recieved the call. finally the cab driver kept my phn on charging & I got connected to him & he came to return my phone & charged me good amount for getting it back. I can't understand y can't uber got me connected to the driver if I know the cab's no.my ride details etc customer support is pathetic 😡",1,0,4.556.10005,2024-12-17 17:41:53,,,4.556.10005
58a5a3dd-6097-4631-878c-c5ab9a40b4b0,Amy Arenas,https://play-lh.googleusercontent.com/a/ACg8ocK39TZyDVawLoFb1ykv7xnX22WtF_l1d2_b1HjM4eUnWnsP6g=mo,I am very very satisfied with my Uber service I'm new to Uber. I was faithful to lyfte for like 2 years but there prices were starting to get ridiculous. And I've always waited more then 20 to 30 minutes for my rides. Now with Uber I've never waited more then 10 minutes and really like that getting off of work I didn't enjoy waiting 30 to 45 minutes to go home. Now I'm picked up in 9 minutes or less.,5,1,4.555.10003,2024-12-09 16:11:50,,,4.555.10003
b5e75f99-fd58-4065-b000-f0e67d6c2bab,Sukla Halder,https://play-lh.googleusercontent.com/a-/ALV-UjVW4Bqo7QjLx7F-ueMOYsR_MLJYwfk6m4lCLY4POsM8n-Kkf5rm,"This is very easy to use and user friendly, but one thing I didnt like about this that after booking the driver calls us and asks the route to pickup location I mean I'm not a very local guy so I don't know i use the default location which automatically comes after opening the app and i choose that location as a pickup location but then they calls and asks the route to my pickup location, dude I literally told you in the app where am I so why you calling me now asking where am I?",4,0,4.556.10005,2024-12-21 19:38:22,,,4.556.10005
581b4ee1-5a7c-4bb1-a086-987e627785ba,Saumya Patiyal,https://play-lh.googleusercontent.com/a/ACg8ocIQ9Hqaf0HozTyUxiupMvhvHmFklQFOV7Q8r3jCbaLiuQqX0Q=mo,1) make it kinda harder to cancel rides by asking you many times. i distinctly remember cancelling a ride only to look at my phone and see that the driver was waiting for me. now I have to pay cancellation fees even tho i cancelled during the matching process before a driver was assigned to me. 2) more expensive that other platforms.,1,1,4.555.10003,2024-12-09 05:34:31,,,4.555.10003
8f0803f6-f0a7-4dbb-ba62-ba798cf89c14,Brittany Oconnor,https://play-lh.googleusercontent.com/a-/ALV-UjVHOfbRsKy4kHlihfk_3HkzizVU5WY8MSDxDxTRn_4qAk5qWEnt0A,Uber is absolute trash. I left something behind on accident and they wanted 20 dollars for the driver to bring it back but said they would only get 10 and keep 10 for the company. Drivers are rarely on time and almost never show up to the correct location,1,0,4.555.10003,2024-12-21 13:45:13,,,4.555.10003
b331623e-71cf-4a41-8751-d92da800d60e,jerome hendricks,https://play-lh.googleusercontent.com/a/ACg8ocLGaOqIFQVchweYRhdY_PkjTuKtZFPnNkSAFBwSjELoe4QyeQ=mo,"I have a few issues regarding payments etc. Issue 1: I booked a ride for my wife, the driver let her wait for 15 mins saying he is on his way then cancels but when I canceled a ride after 3mins I have to pay a cancelation fee, the driver was 5 mins away when I booked. Issue 2: I booked a ride on Uber Lite app, it gave me an amount of R56 + R10 cancelation fee, when my wife had to pay the driver opened the Uber app and it gave an amount of R100, how can these 2 apps give different amounts?",1,1,4.555.10003,2024-12-09 21:52:17,,,4.555.10003
ef2f1a18-b5cd-4601-b17a-59705ea8209a,Maya Williams,https://play-lh.googleusercontent.com/a-/ALV-UjW5ScL3wMoyvbapLUSSRv9FcCtx6L_UO10vL1adDUfGnbQkMu0,"The Uber eats section is annoying. When I'm trying to give directions to my delivery driver, it doesn't give me the option to show them pictures of my location. If the app adds this feature, then it would make both our lives easier",1,1,4.555.10003,2024-12-10 23:03:26,,,4.555.10003
2f53d830-1317-4e1f-b77f-9c4ee4096efb,Richard T,https://play-lh.googleusercontent.com/a/ACg8ocLk18PoL5DwWl-e1r6DC5ZvgpFS4i6XHOF0wr_B__f_Cc08Fw=mo,"This review is related to uber transport cars and autos. Rates are ok, except for the cancellation charges which are totally irritating....Not all cancellations are customers fault....99 percent the cancellation issue is not related to customer.....if this issue is addressed uber would be the most preferred.",4,1,4.555.10003,2024-12-10 17:20:29,,,4.555.10003
cb22f7d9-7350-40c9-bfba-d399f3f814cc,Shawn Tang,https://play-lh.googleusercontent.com/a-/ALV-UjW6ezlvyg5Ia1ZXIDY4kvOah5U0RrMYweGOFXLUGAD9GPgbNGA4gw,"Uber Share is so terrible its a joke. For less than 10% off the cost of a normal ride, you essentially give up your right for Uber to value your time at all. A 15 minute ride home becomes 1 hr+ because the app just wants you to wait. Matching a driver takes 5 mins. Driver's arriving in 3 mins but has to make a U-turn to pick up someone else so add another 9 mins. Co-rider is late so too bad wait another 5 mins. GPS then decides to take a longer route and navigated into a traffic jam. Great!",1,0,4.556.10005,2024-12-19 06:18:29,,,4.556.10005
254ded00-92e4-4888-b532-78834ae737d4,All happy,https://play-lh.googleusercontent.com/a/ACg8ocItVhZ6lZSZjxVXBRFuWt2JPDc39mLTUtcMYVh8dERD91Ypog=mo,first the experience was very nice and prices were budget friendly but suddenly the price of the cabs specially the auto prices skyrocketed the auto cab which we used to book for ₹110 to ₹125 now for the same distance its charging ₹170 to ₹220. Huge disappointment. Very very rarely going to use uber in near future.,3,0,4.556.10005,2024-12-17 16:14:56,,,4.556.10005
a82484bf-aaf4-4231-a26a-d1f75a400526,itzlavanya Sanker,https://play-lh.googleusercontent.com/a-/ALV-UjWIdN8BZ7Q2SdFoxxStoryWviQfrOR2QZUYLtTBNb1fmd1OHnfE,"Uber is not as good now as before. The drivers are demanding more payment or asking for the drop location.Once i went out for lunch and i was dropping my friend off somewhere while going back home, so i added two stops. The auto driver said ""two stops why did you book less money will come!"" Then i had to drop my friend and rebook again . And today also 227 was total, driver took very long route then i ended up paying 300😫😫😫 lots of problems like this are happening.",3,1,4.556.10005,2024-12-12 09:02:19,,,4.556.10005
6d89eeec-cbdd-41a8-b2ab-097085d53dfd,Deborah Gottlieb,https://play-lh.googleusercontent.com/a/ACg8ocJBIt4XWIzzLQ4LmYjbfgrV9z8mA22mPTVPCQsLnWqq9XmESA=mo,"I had my first Uber ride today. Not only was the driver prompt and polite but very honest. I inadvertently left my cell phone on the back seat when I exited his vehicle. He returned my phone to me in a very reasonable amount of time and I truly appreciate his kindness and consideration. Needless to say, I tipped him accordingly.",5,0,4.556.10005,2024-12-17 22:38:14,,,4.556.10005
4332711a-3cef-43c2-8ee5-6272c4913b42,Keoni Rillamas,https://play-lh.googleusercontent.com/a/ACg8ocJywQSqYEw50IUKIRBoiAjExGtCeZhN6Nf6bd6pwvdQNN2WGw=mo,So I got charged $18.49 for a trip I didn't even take. I canceled it due to UBER taking too long to find a driver. I disputed the charge and was refunded a $1 and some change which left a charge of $17.07. From my understanding I thought it was a charge of $5 for a cancelation fee.,1,0,4.556.10005,2024-12-16 05:28:36,,,4.556.10005
0b7d3d3f-e920-4ca8-9d53-68553156c596,Chauhan Nirav,https://play-lh.googleusercontent.com/a-/ALV-UjWLiQlPm7QpIOWVVlV1XsQ0IdjRu79AR3tcfmRKdnxEZ4jUV4Nj,"The fare has been updated up to three times from the regular due to high demand. Having a pickup from Ahmedabad railway station to my home was a bad experience for me. I got a fare of 148/-, but then the fare was raised to 450/- due to high demand. The intention behind this was to deceive customers and make additional income from the situation. Uber is not my recommendation.",1,2,4.555.10003,2024-12-09 08:27:00,,,4.555.10003
b589e85b-b64b-44ab-83b6-99ecec72cee1,Rahul Sood,https://play-lh.googleusercontent.com/a-/ALV-UjVX2bDs1FVYIQ8LYwISe6OfsgvDmcd0JcVWb61KOetckfXT_mEo,Uber does not keep its promises. They gave me an offer to rent a car and get CAD 30 cashback. I followed all the steps and Terms & Conditions as per the available options but never got the promised cashback. When I raised the support ticket they just kept on wasting time and moved my ticket to Archive folder. This is just one incident. There have been many such incidents. I will now shift from Uber and try some other taxi service company which is honest and keeps its promises!,1,2,4.555.10003,2024-12-15 07:25:57,,,4.555.10003
5a4756d5-3331-427c-9d16-2f4756b185d9,Meh Ree,https://play-lh.googleusercontent.com/a-/ALV-UjW4U_13VQp2PaXNXp3KKh76PH1lAYuq8--CGVU1J5bnMp2N4TlX,Hi. I been using Uber for my trips. I usually don't have a problem with it. Except after last night. I got billed twice to my account. Once last night agter and the next morning. I brought this issue to them. I'm still waiting for a reply. Hopefully I get a refund for the amount they took this morning.,1,0,4.556.10005,2024-12-20 20:43:41,,,4.556.10005
fdc9eb45-11d6-4793-856d-bf3090aa0d3b,Mark Slater,https://play-lh.googleusercontent.com/a-/ALV-UjVxrB37A4QyCxjEc_03mF4KxZTAKYaZUvEOZS5mWByVZ8ZFm-p6,Terrible experience. Charged.almost £25 for a booking I accidentally clicked that was then cancelled in 1 minute of booking. I've tried getting a refund but failed. Absolutely terrible customer service. Uber have fast become a taxi service I no longer trust.,1,0,4.556.10005,2024-12-18 23:52:38,,,4.556.10005
a9c5c904-951d-4eb6-b44c-ab8871006ba0,Prahlad Pai,https://play-lh.googleusercontent.com/a-/ALV-UjVbX2z4piD7ibKw60kgto158MXbrgn0nAMoeY2rkQtM-kop2uyl,The best cab aggregator in India. No doubt. I have always had a great experience with Uber compared to other services. Yes there are annoying drivers and random cancellations which is out of Uber's capability but the service is top notch.,5,1,4.556.10005,2024-12-16 17:30:08,,,4.556.10005
1ac1d72c-9bc7-4c83-9c77-977b8cae05a7,Tony Jackson,https://play-lh.googleusercontent.com/a/ACg8ocLj3kNObnfWpNqAunPVUd2sGDybOdtquuD0jn-3ejqcQi4omNE=mo,"What has happened to this once great service? Am in Bristol. Uber constantly cancels, and then the only option is waiting and waiting and waiting for a shared lift home. Awful. Move to another service. This now sucks edit. How has Uber got a 4.5 rating. Look at recent reviews. It's a one star service. What's more annoying is that last year my trip would have cost 20 quid. This new sharing con showed that 3 of us all paid 20 quid. So Uber makes more money and offers us a worse experience. Bolt.",1,1,4.556.10005,2024-12-13 04:49:13,,,4.556.10005
fb67c4cf-3e08-4e29-befb-c2b8adde80e2,Kieran “Ken” Sniadowski,https://play-lh.googleusercontent.com/a-/ALV-UjVIf3rV0XSR1ah-yc5OLALdt3Lc6RDAa_ZIq7Ld6ztX5w4r9pmXzQ,"You all charged for a rental a few weeks ago in which we were under the impression that the rental would drop off at our house, but instead, we apparently were supposed to be at New Castle Delaware in which we wouldn't had made the time either way. So why do you think I needed a rental because my truck was in the shop for the weekend. So, how was I supposed to get to the pickup spot. Meanwhile, you all kept $130.00 that really sucks because I rented another car the following day.",1,1,4.556.10005,2024-12-13 18:01:47,,,4.556.10005
d9d2e7d5-c92d-4012-849b-04c47d4c2f9d,Andy Southern,https://play-lh.googleusercontent.com/a-/ALV-UjWqd3-KiX8smAmvgnBzV8hvV13AhsmUGerTYzhaMzGoKL2ID5blHA,"Set pick up point, scroll map, pick up point remains where it was on the screen. A pretty fundamental bug in software that Is supposed to help you meet with drivers. If I could rate 0/5 I would. Near useless.",1,3,4.555.10003,2024-12-06 22:38:56,,,4.555.10003
2a31d0e1-cdbf-413a-a28a-1ba45607d78a,Juliana Valles,https://play-lh.googleusercontent.com/a-/ALV-UjWFyFrf3DXdtD1xAizVcccvGrDa1dGXM8STA1owf5QLKHJM180,"I try logging into my account. It says it'll send a verification code to my phone number. It never does. It then says it'll send one to my email, so I try that. It works, but then tells me I also need to verify my CVV. I do. It tells me there's an error and won't let me move forward. I try using a new account. It won't even send my email a verification code. What is going on? I'd rather use any other delivery service at this point.",1,2,4.555.10003,2024-12-12 05:01:16,,,4.555.10003
59e3f6e3-baf4-481a-868c-2d4d2741af34,Satvik Suman Barnwal,https://play-lh.googleusercontent.com/a-/ALV-UjXHDZ7LOIBq96QEjE6EJRcAdaoiCDol1lEl4G-acFwnqNX2_OvL,Never select payment method as wallet as I found Uber hikes the fare after completing ride. As long as I was using cash payment the initial estimate and final fare were same. The moment I switched to wallet based payment the final fare deducted from wallet was much higher than initial estimate. What AI Uber app is applying to deceive riders?,2,0,4.556.10005,2024-12-15 15:37:24,,,4.556.10005
95f8e75b-25f9-45f3-b40d-1a0243e08ef7,Sweety Sweety,https://play-lh.googleusercontent.com/a/ACg8ocKuFWaIaKTFMo4W4lwytzcS_Gy_uvQ27wAJt1gN37uy73wsOA=mo,"Some additional amount is shown to the passenger before booking the vehicle and after arrival the amount is immediately increased and presented to the customer. This is very bad behavior of Uber people, first I booked Ola cab but after its sudden closure I started booking cab from Uber but Ola never did such scam as Uber has done. Please keep in mind that whatever amount is shown to the customer by Uber should remain the same in the end because these small amounts are very profitable for Uber",1,2,4.555.10003,2024-12-07 17:09:56,,,4.555.10003
d84f6a7a-848d-4ec9-9f62-9413f6b9569a,Bishor Devassykutty,https://play-lh.googleusercontent.com/a/ACg8ocKJXbmto6GD2IChrOEAw-ULnoV_i0nsgn1641jK2aRVYZJPgQ=mo,"I just took a ride yesterday and the fare shown was 465. When we reached the destination driver demanded extra 50%( Rs 235)in the name of return trip. We told him we can't pay that and had an argument. But he was persistent, and as we had to catch the train so we paid and left. Later we contacted Uber for refund , they said they can't do anything about it. DONT BOOK UBER TAXIS IF YOU DONT WANT TO LOOSE MONEY.",1,1,4.555.10003,2024-12-11 18:31:58,,,4.555.10003
766e2f53-0166-4465-9995-3992b22944c2,Carolina Tello Zeleski,https://play-lh.googleusercontent.com/a-/ALV-UjXL64UhIWYvrsFuzbH4oWcPygAhYWw1sNKA4LmXwpiwcHgjpd3ntQ,"My company encourages employees to use Uber, but my last two experiences with drivers in multiple cities have been so negative, that I think I'm going back to taking cabs. Drivers without trunk space for luggage, dirty cars, broken AC, cluttered seats...I don't know if the standards for drivers have been relaxed, but it's no longer a reliable service.",2,2,4.556.10005,2024-12-13 23:36:46,,,4.556.10005
0ffd1c34-56ad-4c6e-bab9-7db5eb4be9b5,Mahima Garg,https://play-lh.googleusercontent.com/a-/ALV-UjWFnpq_Hq1eANdNyOQG09Vub-XcN_evgqumATq72weh_lLtcHW4Qw,Stuck on the payment screen post the latest update. Does not let me book a new ride. There's no pending payment in the app. Customer support has not been able to help. Not the expected app experience from a global tech giant. It's been two weeks since I have been unable to use the app. Been a user since 10+ years now...,1,66,4.555.10003,2024-12-11 14:54:54,,,4.555.10003
79c4368e-aaf8-474d-8a39-56fc7ba03de0,Garcia N,https://play-lh.googleusercontent.com/a-/ALV-UjVRbLLLVF8x-2uzYnn6hXhmh74I_AD2-5ulM25gQvabFvcKki_cUQ,"App was working fine, all of a sudden I can't connect to Uber when I'm out on the street. I can only order Uber when I'm at home with Wifi signal. Problem is NOT with my phone either, because other apps while I'm out work without Wifi signal. 🤔",1,0,4.556.10005,2024-12-19 15:31:25,,,4.556.10005
4e9ff2b2-d984-4a1b-bf24-379407def959,Sanjay Kapoor,https://play-lh.googleusercontent.com/a-/ALV-UjWlnx6dP1DbBDOZ4GPfG3B7hO0zzW2iejcwbXgGdf_uXIB9YlZD,UBER do not have control on their cab drivers. I will say zero control and they don't care about customer issues. Cab drivers cancel ride as per their convenience after booking. And it's a regular feature. My yesterday experience was also similar 3 rides cancelled by driver before I get 4th attempt. Uber is not fit for services,1,2,4.555.10003,2024-12-08 03:45:16,,,4.555.10003
59874739-d2b7-4ebc-b382-5d18f401ce76,I Rose,https://play-lh.googleusercontent.com/a-/ALV-UjVQC7oxYm-ZSHGlVAs97VGPU0J1M8Wx6Gv30MLLi3Koeks1t38,I reserved a taxi for the following morning. Ride was accepted. Taxi never turned up and driver never responded to my messages or calls so I had to cancel in order to book a new ride. I got charged the full ride plus cancellation fee and almost missed a meeting. Support has been abysmal.,1,1,4.555.10003,2024-12-11 14:22:36,,,4.555.10003
2de20434-64bd-4d7c-8ac0-06954f2dcc9b,Nathan Nicholson,https://play-lh.googleusercontent.com/a/ACg8ocIR-D3Hozqcz5jZJPn5HcQgybeX7OXrtaIa1idcy4a3OFtRaA=mo,"Review for Uber EATS only. Do not use Uber Eats as opposed to other delivery services. Delivery drivers accept your order, then proceed to not deliver your order but to run personal errands or deliver for other services (Uber Eats GPS shows their location). There is no time limit for the deliver drivers so they can choose how long to take to deliver your order. You may wait 20 minutes, or 2 hours, it's up to them. I had two delivery drivers accept my order and then drive miles away. Do not use",1,1,4.555.10003,2024-12-11 15:05:15,,,4.555.10003
