reviewId,userName,userImage,content,score,thumbsUpCount,reviewCreatedVersion,at,replyContent,repliedAt,appVersion
12421c46-3eff-46e4-a8ab-277ff94c5f9e,Alfred Haley,https://play-lh.googleusercontent.com/a/ACg8ocJrjPsLyOS4_TU50VHiYicLv75LkebMjbglXVbfDCZxOLwJgg=mo,"I have stopped using this app due to the ridiculous price increase. In less than 6 months, the price has increased by around 50%. One trip I would take used to cost around $35 now costs over $50 and, at times, close to $80. Forcing me to find alternate means of transport. Also, the quality of a lot of drivers has gone downhill.",1,14,4.546.10002,2024-10-12 10:01:39,,,4.546.10002
11f5e493-7656-47bf-8277-9d0786333172,Krishna Sonari,https://play-lh.googleusercontent.com/a-/ALV-UjU8ch_6wd0fMuC15a-hU5IuZVWxef5QsZsEWcgeLQKgn1hWNvIL,"I'm from Guwahati,Assam. I'm very Disappointed with Uber Bike. Please stop your service in Our City Guwahati. It's a very irritating service. I will uninstall it now for forever. I missed my Train due this third class service. Uber Bike is the worst option if you want drop. Every Uber Captain Demands for Extra Money that is too more than Rapido. If you thinking to book Uber for dropping to Railway station or Airport, then ignore it. Your Train and flight will be miss definately.",1,0,4.552.10000,2024-11-23 10:32:57,,,4.552.10000
7417a280-194b-4a69-ab2c-a4764e8f6c3a,Michael Kohler-Rausch,https://play-lh.googleusercontent.com/a-/ALV-UjU7c5ZZcTtXjgMzlznd3uJxwelB4NxNOAMWnuUlzyjwBYeRxIA7RA,"I've used Uber quite a bit and it normally works. But it's a real problem when you cannot leave the company feedback on what they do. So, I'm here. The app was not working and took too long to match a driver. I switched to Lyft and that worked immediately. Uber charged me a cancel fee. Never got a notification of the drive. Never got called or texted by the driver. It took me a few minutes, but they do allow fee refund. But you can't talk to anyone!",4,5,4.550.10001,2024-11-06 04:12:20,,,4.550.10001
766b913a-c5dd-41fb-a3d0-37749d0a439c,ambarish deshpande,https://play-lh.googleusercontent.com/a-/ALV-UjWg6l3SRjTiFSaq7klM4_Bn1yP8ZvUWqlWDdshNLERIvdTRMfkd,"Good amount of drivers are associated with them. Easy to use. The price fluctuations are crazy, they increased prices by 37% for same route now for no reason (rains, supply demand etc). Their grievance number or email id are not at all visible on app meaning they don't want address any complaint. They just have bunch of FAQs on problems which probably 95% users won't face. Add proper phone numbers and email address so we can record our complaints in writing.",3,1,4.548.10001,2024-10-22 07:36:02,,,4.548.10001
1756b662-8950-41fe-ba28-61c0c9243cac,Sadie Purcell,https://play-lh.googleusercontent.com/a-/ALV-UjVnQ_Bdrbe9ijcAOtF7C2zLcEg5JT2dM1p02oFWkyJ6qF2_TtFE,Customer support is a joke. Only drivers can get help. Now they are charging for trips that the driver doesn't show for. Do better uber and give customers a support option. Been trying to contact support for a week now with no response.,1,3,4.554.10001,2024-12-02 21:09:53,,,4.554.10001
1f643cbd-8255-45c1-8407-b73da22253c5,Ronak Bhavsar,https://play-lh.googleusercontent.com/a-/ALV-UjX8xv6-iv23M7ZM_3dzkIVXCn788tQhpnSM3G1WDWbzW7n6qJEP,"Disappointing experience with Uber. I booked a ride showing ₹193, but on arrival, I was charged ₹300 without any prior notice or clear explanation. Such sudden fare changes feel misleading and impact trust in the service. If fare adjustments are possible, they should be clearly communicated upfront. Uber needs to improve transparency; otherwise, I’ll rethink using the app and leave a negative review to alert other users",2,30,4.550.10001,2024-11-11 14:38:36,,,4.550.10001
357a3ed0-1488-4169-b2d4-0233900f1415,Rahman Abdur,https://play-lh.googleusercontent.com/a-/ALV-UjU62PQWlzeAlfbaGaZF0_0WjqXtfPQwvR4KV7gBVVw66Ypng133,Awful service...You guys should not give any access or an account to an Uber driver who doesn't wants to accept a ride if it's a low cost ride. If your service only works for for long rides and more money then it doesn't seem to have an exact purpose of your service... Work on it .. I have been noticing this same problem since few weeks. It's awful,1,0,4.554.10001,2024-12-18 04:09:28,,,4.554.10001
7471d9b0-fccb-45a4-bf30-bd3bf5d733ee,Akshada Lakhawade,https://play-lh.googleusercontent.com/a-/ALV-UjWIzM4QAeX1pA5rfhINMdhUT8Z2bOPSOWuKQo14qyArUrDxOKtN,Worst application I've been waiting for the driver to pickup since 30mins and trying to book but whenever someone picks up they says we take night charges and on uber se don't take night pickup as they give us less amount Then why the hell you guys keep your application open at night when your driver's don't accepts the pickup and night idiots really disappointed and uninstall this app It's a suggestion not to download this application it will waste your time,1,0,4.550.10001,2024-11-25 03:28:13,,,4.550.10001
b44f9a1c-fb71-448e-9ecc-5293529056a3,Wendy Summer (Travel lady),https://play-lh.googleusercontent.com/a/ACg8ocIDTi5QI0Q0do5FTyQ9ztFgiuS51BPL4ukOBdFRy2yLtpCL7Q=mo,It requested my location then destination and after I added these then returned to original screen over and over again so I felt like a hamster on a wheel doing the same thing over and over as I was researching for the cost of the journey it was very frustrating as it never did give me a cost for Uber assist trip the app wants to make customers vomit to the journey without knowing the cost it's annoying and time consuming,1,6,4.547.10001,2024-10-13 17:10:52,,,4.547.10001
1d61956d-b48b-4b38-a70b-4e58599456ce,Daisy Gonzalez,https://play-lh.googleusercontent.com/a-/ALV-UjUqEaNI00y2KouFX_j2ooeWfF3BIEL9D0i_zQU23rso9r46rpUJ,I have an issue with all 98% of your drivers. I check the plate to match what I was given on the app. I open the door and give the driver his name. They respond YES. But 98% don't repeat my name or the destination. They should aways make sure they are picking up the correct fare. Otherwise. Things are good.,3,4,4.549.10000,2024-10-28 22:15:55,,,4.549.10000
70c47747-630c-415a-ac50-de4a5a285045,Tory Reese,https://play-lh.googleusercontent.com/a-/ALV-UjW2UIXZpgjLZHCMlpTXViSBMuCTVPDH8luLtvpxsiiX1RMvIrwT,"Money theives. No customer loyalty. I've been screwed multiple times by the delivery drivers. The app says they pay you back for damaged or missing items, but you cannot access the money in the Uber cash account or during separate orders. I'm sick of trusting this trick of an app or company or whatever! Stop bogarting MY money. DONE with Uber.",1,3,4.552.10000,2024-11-18 01:09:15,,,4.552.10000
013f9fb8-778f-4d07-82e3-3ca7ad547c00,Johnny Frost,https://play-lh.googleusercontent.com/a-/ALV-UjUQPoGBtrUdmgdiwrdt_3SHLQGDoGg5R3lc0jMAujE7Tp8hDAOb,I am now so frustrated with Uber and DoorDash both I can never ever get my orders right with these guys either one of these companies it is the same can't order a combo with a drink cause I never get the drink. The $5 ranch I ordered with the $50 I spent from Buffalo Wild WingsJust all over the bottom of the bag. I almost lost all my food through the bag cause it was just so soaked all around the food I want to dip my ranch not soaking my food in it. From my experience every attempt is awful.,1,1,4.554.10001,2024-12-10 01:19:36,,,4.554.10001
b722bb57-7b35-44c3-a123-6bdf8825d7bd,Bartholomew Gordon,https://play-lh.googleusercontent.com/a/ACg8ocJ7JnPClpEM9hT9hIyujpr0vZ-uc4lBYvpxFFKWGVaz5oE7Nw=mo,"My overall experience is good. I use Uber transportation to get back and forth to work. I work in the autism community to help support those with special needs. So I really appreciate Uber offering discounted rates and perks, very beneficial!!",5,0,4.554.10001,2024-11-30 01:28:46,,,4.554.10001
31d06384-019f-44cf-a36a-a63d6f1301ed,Haroon Tanha,https://play-lh.googleusercontent.com/a/ACg8ocLFHjphg2T2wMtcoOMV02tsW7K8d8UotVF8vZhak9g_L09Xyg=mo,I had a terrible experience today as no drivers showed up. It seems drivers are avoiding Uber because they’re being paid less and opting for other apps or minicab offices instead. It’s disgraceful that Uber isn’t supporting its drivers and riders properly. This might be the beginning of the end for you if things don’t change.,1,0,4.555.10003,2024-12-07 06:37:14,,,4.555.10003
fbad728c-b9ad-4be9-a38a-de077f61430d,sdocb,https://play-lh.googleusercontent.com/a-/ALV-UjWgcZtEJrtVKVQIHZ-dDFd7FuvX0eLbahWjEeBkV_cxDMGG6wyt,This was my first Uber ride. It was a little frustrating trying to get a driver. I would secure a ride and then it would get canceled. The driver I ended up with was amazing! It could not have been a better experience with the driver and the ride. They need to do something about the ride canceling without notification though.,4,36,4.546.10002,2024-10-08 01:18:51,,,4.546.10002
62bcd906-0c7f-4170-ae98-219cf594baa8,Sumit Sharma,https://play-lh.googleusercontent.com/a-/ALV-UjWnxUURmDpkLIta7ELDAL12fePM7ebgNe4eeksLN_NZZqoSCCIFmQ,"Pathetic drivers in Uber. Once the cab is booked, they come to the pickup point and cancel the ride saying we don't go to that location. Happens every time. Better switch to some other app.",1,0,4.547.10001,2024-11-28 10:04:13,,,4.547.10001
5decb534-e8f8-453e-99a9-2b9f258d6145,Daniela Aguilera,https://play-lh.googleusercontent.com/a/ACg8ocIVpFlTNsA5dDbNP_PDqFUZCBzGNn-fgkJcvxENaRydNFZQ_A=mo,"In general works very well except for the fact in many occasions drivers accept trips but then they don't show up with the excuse they can't cancel them and not all of them take the time to let you know. Also, it would be great if you had the option to complain about a specific driver and if you made those complaints public. Personally I would like to know a bit about the driver before to get in his car, and the stars don't really say much.",3,2,4.547.10001,2024-11-14 17:05:58,,,4.547.10001
d54fae91-4a37-4f93-b37e-2de93e1429a5,Ganesan Palasur,https://play-lh.googleusercontent.com/a-/ALV-UjVpeWCjJTd1A6yx_S5tkou6RZ-df4Nu4Ru5t5Lsipcw7q9-cQvA,The app is convenient. Given 4 Star because In Mumbai while travelling to atal Setu drivers always insist to pay toll charges separately even though included in final bill. Please show final fare clearly indicating toll amount included in final bill to avoid duplication.,4,0,4.553.10000,2024-11-28 07:51:10,,,4.553.10000
9f437c4a-1662-41a6-866d-9a40402d7560,S S,https://play-lh.googleusercontent.com/a-/ALV-UjWZtZeJNkphr0BEQI18_PLkzmMg0PSWL8674o-3JcIdS_JjJQA-xw,"rename this app to ""cold food"". They route delivery guys for a quest through the whole city. Their delivery time twice slower than any other app and it's with uber one enabled.",1,2,4.556.10005,2024-12-16 03:49:18,,,4.556.10005
3bcbc232-0e42-45b6-a462-2e0b24b54552,Jorge Oliveira,https://play-lh.googleusercontent.com/a-/ALV-UjWSXQ7E10hV1gFEoDXLP_tCC65SxuoVtBYjVu0IzGn22qwu0GSk,"Complete trash app. Almost impossible to schedule a pick up, because the app insists in putting the wrong street and asking for the flight. After a mistake due to the complete nonsense, I immediately try to cancel the pickup and they charge me 11€. Just use bolt",1,0,4.549.10000,2024-10-30 22:36:33,,,4.549.10000
508f755d-599b-4851-b85b-285b2fb130cb,Lauren,https://play-lh.googleusercontent.com/a/ACg8ocJG95Gd_JfpEqDquwAosZ4QWOJIz9EgcTOg1Eodb_DOztopqdQ=mo,"Comfy. Roomy. However, I hope one day that Uber can make a built-in feature on the app to request specific drivers. That would be awesome, too for an option.",5,0,4.556.10005,2024-12-21 07:49:25,,,4.556.10005
7ac9f160-e508-43d2-be90-fb8d5f4a9dc3,Aachal Modak,https://play-lh.googleusercontent.com/a-/ALV-UjXUIN55h8woQIDiNxhoZh4gohVOB6ftmc5OGQpGHw0oJ76GTnia,Worst app ever. Too many bugs!! Driver cancelled my ride and uber demanded me to pay for that cancellation when I didn't even cancelled the ride. When I tried free call to the same driver before him cancelling my ride that call was on entire time for around 1hr in the background when I tried to end it didn't ended needed to restart my phone. Their customer service is worst. Never get to report the actual issue. Never ever gonna use this app again.,1,10,4.548.10001,2024-10-22 16:24:17,,,4.548.10001
ec58153e-3b37-4a37-be45-4a9c950f840f,Kgopotso Rashetle,https://play-lh.googleusercontent.com/a/ACg8ocI0a3RGxtyELHtrcANhdUAlfOfMq721AX8tZ40nVgNg25VGwQ=mo,"The app is great. I just think that on uber eats, people should be allowed to rate the restaurant after a few hrs or day from delivery, cause rating the restaurant right after delivery is not logical since I can't rate food I haven't eaten. Also just like clothing shops I think we should be able view ratings of food and drivers. It'll improve the service and I don't get the point of reviewing if customers can't use it for their benefit. Also tipping before a service don't make sense.",4,1,4.553.10000,2024-11-26 21:43:02,,,4.553.10000
6cade381-52ed-4eec-8e92-0c29f5e671d7,Lisa B,https://play-lh.googleusercontent.com/a-/ALV-UjX7JWbToHcFsfixVh6QXPxJH6zdXyb6tHKv0jVgroL5z-gd7vjdrg,"The service is becoming horrendous. Having been told by 2 drivers that they won't accept anything below a £10 fare I'm left waiting for ages before I give up & go elsewhere. I've even had drivers accept my request then cancel minutes later which causes me to be late for work sometimes. Used to be a 1st class service now it's just not worth using. Even right now I'm needing to go somewhere, costs less than £7, nothing unless I want to now pay £22.85 for a 10 min journey that was £7 5 minutes ago",1,1,4.554.10001,2024-11-30 20:55:23,,,4.554.10001
a20a7a62-53e0-4b34-b03b-eb57b1ff088e,Rahul Alom,https://play-lh.googleusercontent.com/a-/ALV-UjXXzGYqFSrDxMwDiYVmq8zrfO-Kv0mJTTY7KDKSWt_NKAWo02hT,"Batter than other apps. annoying thing is they're charging for 1 minutes late about 87p 🙄 i've send an message to the driver that please come to this point, and he replied "" ok got it"" but he didn’t come on that address. I was standing in the rain.",4,1,4.553.10000,2024-11-23 14:24:22,,,4.553.10000
1b17baf3-3af1-476a-8235-fca777b8ed97,Sona Raut,https://play-lh.googleusercontent.com/a/ACg8ocJwEcjm-jz6WoTTLtNHdeix4FAbUpmLh5ozJ-9rcCEGOnd3dQ=mo,"Worst app ever unlucky but this is my second ride with uber uber did or do froud with us actually when we booked cab/auto there show a fix amount so we booked right, then once we reached on destination suddenly within a sec or minute payment increase this happened second with me and it's happened before as well that time I thought it's ok if uber cab charge more some money but it's happened again 😠 they taken a benifits of needi guys really worst service.",1,1,4.551.10000,2024-11-20 00:41:22,,,4.551.10000
1b95d3e0-7c2a-4005-be8e-7d4ef9f533d4,Mrutyunjaya Parida,https://play-lh.googleusercontent.com/a-/ALV-UjV2Q5PLhZGXqkELAAqphS81OStD7qYrsl8b5GMH45FUG4QUyKYS,"Uber Performance is good. Only some of Uber drivers do not agree to go after acceptance,they ask addtl amnt. Later they do not cancel and forced the customer to cancel. In that case customer no option to put the note with uber for drivers behaviour. Request to look into this matter...it is in general and facing several times in bhubaneswar, odisha.",4,0,4.553.10000,2024-12-06 09:11:54,,,4.553.10000
ab6eaea7-a39b-45d2-a6cb-fe30a0cb2200,Lakshmi Tejas,https://play-lh.googleusercontent.com/a-/ALV-UjU3YCN_2iQC18DPJv0dcUwId2N6klRUj6LZTHAH0R6ySPtYN0Sa,Payment was set to default after installation. After booking its not able to switch to amazon pay. It is taking cash only. I had no cash to pay the driver. Give option to interchange pick up and drop,2,1,4.553.10000,2024-11-24 16:23:24,,,4.553.10000
834c8072-b96c-4049-838f-ded8f59206d4,Paul,https://play-lh.googleusercontent.com/a-/ALV-UjXo_jAPDWNN_AP3Pr9A7HEOO-GAOcl9cMhOR5TgVwgmcdGiyLXodQ,Unable to get customer service or support. So I'm having to put a fraud on my AMEX account for unknown charges! Hopefully you can figure out how to fix this issue!? That's what I put in Uber support ticket over a month ago... maybe this might work!!!,1,0,4.556.10005,2024-12-19 16:53:46,,,4.556.10005
b30d0e9b-9e9a-4d2f-9ab4-f500023d54b9,Mohammad Zahed Ali,https://play-lh.googleusercontent.com/a-/ALV-UjXYtaFDxFm576S5SaTW5K77IxUHCo_MpYzHYCWL3PejdOZrT24XBw,"These people are basically thieves in daylight. They added the disfunctional Uber eats in to the Uber app. They don't have delivery drivers from the restaurants which they publish and eventually cancel the order without a refund. They give a lame excuse that the restaurant has already prepared the order, So cannot give a refund. This is a robbery app. Stay away from it guys.",1,1,4.553.10000,2024-11-27 15:30:15,,,4.553.10000
9e8bc78a-78a4-4ef2-ad3c-d202a5ab6615,Lee,https://play-lh.googleusercontent.com/a/ACg8ocJS56hxJD6nX4rpqp9y0Iu3Et_JTkKqhyn8KB4FMfSi76PJFg=mo,"It's bad I can't rate 0 stars, the service that you get from Uber is shocking, in that a driver can accept a ride. Then reject it as another might come in which they prefer, leaving you stuck once a driver accepts a job that should be binding. Shocking service.",1,0,4.556.10005,2024-12-21 14:49:29,,,4.556.10005
dc61af3f-5afe-4c66-a87e-c4aad8ae0411,Georgina Little,https://play-lh.googleusercontent.com/a-/ALV-UjV7-TJFM0-sQEMOgWbYmv5HSevK3OM7m_yCpHHIehNP4FosBZht,"Make sure all your card information has been updated with the provider for more than a day, take the 10 mins to set up your account and bingo bango everything is super easy and fast. I mean everything!! Kinda expensive for rides, but really convenient!",5,2,4.554.10001,2024-11-30 00:48:10,,,4.554.10001
fb13d47d-8857-4a50-8b6f-28ea13a8492f,Unsystematic,https://play-lh.googleusercontent.com/a-/ALV-UjVvR95O1hO37BRk_qmP_CUOzPna3MBJcRLmw6zksU1sE0UqUBYL,"Charges me the wrong ammount then says I owe money. Also, as no driver accepted my ride I got charged and refund not issued. Tried calling but it says they don't offer support via phone. Messages but who knows how long they'll take on a weekend night to reply let alone solve this riddle. As a regular customer and as I pay premium on Uber eats and Uber I think I'll be using other companies from now as of this",1,0,4.555.10003,2024-12-07 23:57:31,,,4.555.10003
5b7b5451-a096-4024-ba94-7987276fa262,Andrew Hood5,https://play-lh.googleusercontent.com/a/ACg8ocLulyl7n2VyjYK1xNarv8JvzozCtRAolxyIsK_f1KdBLyxKOg=mo,"Much more efficient and cheaper than taxis, no hidden costs. And fixed price that is shown before travel. Be careful, though. It's only happened once. The driver got lost and added more to the price without telling me. You can dispute it, but there is no drop-down reason for driver error/cheating, etc.",5,68,4.550.10001,2024-11-03 17:34:33,,,4.550.10001
56ffc5e9-28a4-4710-85b4-e56a246e09ea,Indranil Naskar,https://play-lh.googleusercontent.com/a-/ALV-UjUUutA3PUa2YAT3Fwl7m28C7gkHEngOhF0u0ymB79kQHrMqoKzxvg,"The worst support system I've ever seen!! I've tried several times to take help from the support team, but everytime a same guy was there to help me without resolving my problem l.. Saying I've accelerated your concern , no mail support no senior support.. Disgusting apk!",1,1,4.554.10001,2024-12-04 13:43:20,,,4.554.10001
04674a1b-22fe-445e-9b9b-716113f338e9,Marcia Brabbs,https://play-lh.googleusercontent.com/a-/ALV-UjUBlkmZDd5P25kGH6IrDlyJNiEeoy-a-1QOpKJMphfcwnqBVk8,"Unfortunately, Uber App and Uber drivers are not in sync with regards to the location of the new Isle of Man Sea Terminal in Liverpool: I got charged for a trip from the boat to my hotel that I did not take because the driver went to the wrong pick up point. On my way back to the boat, the App had the correct drop off according to the map but the driver still tried to take me to the old dock. *",2,7,4.548.10001,2024-10-24 20:44:19,,,4.548.10001
c46b61c9-9f29-43cd-97d6-ac83f93d314c,Jill Del,https://play-lh.googleusercontent.com/a/ACg8ocK2Z6NO-IrAW3wghPyr0jtdV9WfqIjWE9PB6yTIvCj7BNu-eg=mo,Very good and respectful driver. But I think the app is a little complicated for the average Ghanaian. There should be an easy way to find option to share the ride with a loved one with just a click,5,0,4.555.10003,2024-12-08 21:51:10,,,4.555.10003
1a8a8f75-beae-466f-8c07-4d6ed5ea6e71,Deborah Samuels,https://play-lh.googleusercontent.com/a-/ALV-UjWBZxES1eWFt8Zdm4d27hEqY3c_FiPUfT6KswM6152KMJh9r9vj,"This was a horrible experience. The ride I finally got was good, but I ended up waiting a full hour in the rain because the two previous drivers went to the wrong address. I can't figure out how this happened. It is my residence and there is a big sign at the top of the driveway.",1,0,4.556.10005,2024-12-13 22:11:00,,,4.556.10005
91c1ed40-f451-4d34-a67d-2893058badbc,Savage Diamond,https://play-lh.googleusercontent.com/a-/ALV-UjWgX7QcZ5rnal-sH20N9JDLt7qA3umcVzIJJimLaAqz1JGqnYQ,"Worst service ever when trying to activate a coupon code that didn't went through. I see it's only a scam when its sent to you by email just to make you believe you'll have a great deal, but then it doesn't work. You make a claim and they never give you the full discount you received in 1st place, just ½ the deal. And by the way, Uber Eats made the same trashy move a few years back. I'm out. Never again. Sayonara. Arrivederci. Adiu. Ciao. Adios. Bye. Hasta la vista.",1,4,4.553.10000,2024-11-22 08:03:45,,,4.553.10000
080dc388-b783-46bc-878a-6071fdd97a5d,Carla vant Foort,https://play-lh.googleusercontent.com/a/ACg8ocJNXrYNjgGq66Tugqmn0SF8yo38CM2GPlviDKThwsLyAtOgBA=mo,"Uber is very unreliable. If you book trip for early the next morning, they usually don't pitch up. When they do the one odd time, they arrive late, does not answer the phone when you phone them and when you make other arrangements because you have a plane to catch, they charge you a cancellation fee! I will not use uber again!",1,5,4.547.10001,2024-10-17 15:34:24,,,4.547.10001
ab5c4231-d27a-4d3c-8651-a097a2804af4,sai sumanth,https://play-lh.googleusercontent.com/a-/ALV-UjX0Y46L7cYsg6V1Zso6gUPTKFf_4EHRVRvUfeGhyHQp4F1g8lQ9,Waste app it is showing long route even for short distance also and price is becoming high because of that. It should have option to select route so that price become dynamic based on distance. Literally pissed off,1,0,4.553.10000,2024-12-05 15:35:29,,,4.553.10000
56bf9965-1f85-42cc-a358-f1d166ecbcb5,Craig Pinto,https://play-lh.googleusercontent.com/a/ACg8ocJ4b7ecSirr32iO1mwFWCpJyTDcldnk79tt2L5Hs6MdxSYgAQ=mo,"Ride Service is good, but when things go wrong, customer service is terrible. One driver was very aggressive and demanded more money, and didn't complete the trip, leaving it running. And Uber refuses to let us review or give refund.",1,1,4.553.10000,2024-11-26 22:17:14,,,4.553.10000
1191d006-bb8a-48be-93fd-a931ccc61347,Emmanuel Makau,https://play-lh.googleusercontent.com/a-/ALV-UjXHoMWrTrGhUA-pJHgfQ3mztpJdB4m4lFebSb5FMT_uHPefDr4,"More reliable than all other apps I have ever used. Drivers behave well on this one! I only hate when they ask for the destination before showing up, that means no show or long waits",5,0,4.556.10005,2024-12-21 02:23:36,,,4.556.10005
0485c81b-6d31-4785-8def-672dd141e1e2,Paramita Chakraborty,https://play-lh.googleusercontent.com/a/ACg8ocLgj5oRNTSP7XcFkWGFx6T3Wy6HpWpsp-mdvvRsHa5njvlaHA=mo,"This is a horrible app for shuttles services in Kolkata. It does not allow me to add payment method to book shuttle packages. It an app with bugs. The customer care executives are also least interested to assist. Every time I add payment mode for shuttle packages, it deducts 1 rupees but never adds the payment mode. Everytime I have to pay 150 rs for every shuttle ride even though I can pay 150 for 4 rides. Thanks to Uber that it does not allow that. Very disappointed.",1,8,4.550.10001,2024-11-03 22:02:58,,,4.550.10001
adc9e381-f055-4635-af72-36307c529689,Kaisa Saarinen,https://play-lh.googleusercontent.com/a-/ALV-UjVCTNx-wH9IWm9wy7SxW-JtsnlL5Di2pyLv_zX6_EH-_1GFf7YcjA,"Abysmal customer service. A couple of months ago my phone was stolen and the thief was able to order an Uber on my app - I reported this immediately, but they were weirdly reluctant to issue a refund. Last week I ordered some food, and a 20% discount was supposed to apply, but my card was still charged the full amount. I notified the customer service and requested a refund, but they claim they can't understand the problem. Suspect it's all AI. I think I'll stick to other services from now on.",1,14,4.546.10002,2024-10-05 12:36:05,,,4.546.10002
11ae271c-769b-40e1-8019-46fd18919bca,Ayman Baba,https://play-lh.googleusercontent.com/a/ACg8ocLA99XROg4d2qBaiAoRAEiBk0v430zcV6AYvNPHMLzo-HDWAw=mo,I tried to contact customer service but it was useless to try that so I thought it would be better to write it as a review. I made an order and then canceled it and got a message that it was canceled and asking for the reason. I skipped this step since I was in a hurry. Later the driver called me asking where I was and the next day I was charged for a cancelation fee!!,3,1,4.547.10001,2024-10-15 16:33:31,,,4.547.10001
3eb91d81-2851-4909-bd2e-1e01f2ed2fb3,Marlon,https://play-lh.googleusercontent.com/a-/ALV-UjX7eXaT5Fkzq_XEiByayR2uBaJaJiV4m8yqGqDuhizN3JOroDY,"Very convenient. If you just compare this to other country especially Philippines, this is like luxurious ride. I have tried the LRT/MRT in the Philippines, yes its good but the class and service provided, especially the look of the station, the payment center, the line for passengers, so much different. Also the price for the travel, in the Philippines, it's so expensive. I know it must be because my home country doesn't have enough budget but Qatar Metro in the future can be a good model.",5,46,4.549.10000,2024-10-24 18:52:22,,,4.549.10000
